{
  "build_runs": [
    {
      "compile_command": [
        "/usr/bin/x86_64-linux-gnu-g++-13",
        "-std=c++20",
        "-Wall",
        "-Wextra",
        "-Wpedantic",
        "-Wconversion",
        "-Wsign-conversion",
        "-Wshadow",
        "-Werror",
        "-O2",
        "/workspace/AGI-Core/Image/SPEC/p4/raster_admission.cpp",
        "/workspace/AGI-Core/Image/SPEC/harness/p4/test_raster_admission.cpp",
        "-o",
        "/tmp/image-vision-p4-ijjil7nw/p4-admission-normal"
      ],
      "compiler_output": "",
      "mode": "normal",
      "status": "pass",
      "test_run": {
        "case_results": [
          {
            "catalog_case_id": "ADM-001",
            "label": "positive single/row/column/odd raster shapes",
            "status": "pass",
            "test_id": "P4-TEST-001"
          },
          {
            "catalog_case_id": "ADM-001",
            "label": "GRAY/RGB/RGBA channel classes",
            "status": "pass",
            "test_id": "P4-TEST-002"
          },
          {
            "catalog_case_id": "ADM-002",
            "label": "zero width/height/channels",
            "status": "pass",
            "test_id": "P4-TEST-003"
          },
          {
            "catalog_case_id": "ADM-003",
            "label": "width-height multiplication overflow",
            "status": "pass",
            "test_id": "P4-TEST-004"
          },
          {
            "catalog_case_id": "ADM-003",
            "label": "pixel-channel sample-count overflow",
            "status": "pass",
            "test_id": "P4-TEST-005"
          },
          {
            "catalog_case_id": "ADM-004",
            "label": "checked stride-offset addition and multiplication overflow",
            "status": "pass",
            "test_id": "P4-TEST-006"
          },
          {
            "catalog_case_id": "ADM-003",
            "label": "host pointer-difference representability bound",
            "status": "pass",
            "test_id": "P4-TEST-007"
          },
          {
            "catalog_case_id": "ADM-004",
            "label": "short row and pixel strides",
            "status": "pass",
            "test_id": "P4-TEST-008"
          },
          {
            "catalog_case_id": "ADM-005",
            "label": "unsupported layout/type/order and unknown enum",
            "status": "pass",
            "test_id": "P4-TEST-009"
          },
          {
            "catalog_case_id": "ADM-005",
            "label": "channel count and declared-range consistency",
            "status": "pass",
            "test_id": "P4-TEST-010"
          },
          {
            "catalog_case_id": "ADM-001",
            "label": "declared/actual buffer length and empty input",
            "status": "pass",
            "test_id": "P4-TEST-011"
          },
          {
            "catalog_case_id": "ADM-003",
            "label": "width/height/pixel/channel/byte/work ceilings",
            "status": "pass",
            "test_id": "P4-TEST-012"
          },
          {
            "catalog_case_id": "ADM-001",
            "label": "small-profile exact boundary",
            "status": "pass",
            "test_id": "P4-TEST-013"
          },
          {
            "catalog_case_id": "ADM-001",
            "label": "proposal-only maximum 4096x4096x4 boundary",
            "status": "pass",
            "test_id": "P4-TEST-014"
          },
          {
            "catalog_case_id": "ADM-006",
            "label": "descriptor admission keeps encoded decode on its explicit API",
            "status": "pass",
            "test_id": "P4-TEST-015"
          },
          {
            "catalog_case_id": "ADM-005",
            "label": "invalid limit record fails with profile mismatch",
            "status": "pass",
            "test_id": "P4-TEST-016"
          },
          {
            "catalog_case_id": "ADM-007",
            "label": "cancellation/deadline typed reject and precedence",
            "status": "pass",
            "test_id": "P4-TEST-017"
          },
          {
            "catalog_case_id": "ADM-001",
            "label": "read-only non-owning view aliases caller storage",
            "status": "pass",
            "test_id": "P4-TEST-018"
          },
          {
            "catalog_case_id": "ADM-001",
            "label": "success and failure paths perform no heap allocation",
            "status": "pass",
            "test_id": "P4-TEST-019"
          },
          {
            "catalog_case_id": "ADM-003",
            "label": "over-limit rejection occurs before allocation",
            "status": "pass",
            "test_id": "P4-TEST-020"
          },
          {
            "catalog_case_id": "DEC-001",
            "label": "binary PGM P5 gray pixels decode exactly with comments",
            "status": "pass",
            "test_id": "P4-TEST-021"
          },
          {
            "catalog_case_id": "DEC-001",
            "label": "binary PPM P6 RGB pixels decode exactly",
            "status": "pass",
            "test_id": "P4-TEST-022"
          },
          {
            "catalog_case_id": "DEC-002",
            "label": "ASCII variants and non-255 maxval reject",
            "status": "pass",
            "test_id": "P4-TEST-023"
          },
          {
            "catalog_case_id": "DEC-003",
            "label": "malformed header tokens and separators reject",
            "status": "pass",
            "test_id": "P4-TEST-024"
          },
          {
            "catalog_case_id": "DEC-003",
            "label": "truncated and extra raster bytes reject atomically",
            "status": "pass",
            "test_id": "P4-TEST-025"
          },
          {
            "catalog_case_id": "ADM-003",
            "label": "encoded/header/dimension/channel/byte/work caps preflight",
            "status": "pass",
            "test_id": "P4-TEST-026"
          },
          {
            "catalog_case_id": "ADM-003",
            "label": "huge dimensions reject before output allocation",
            "status": "pass",
            "test_id": "P4-TEST-027"
          },
          {
            "catalog_case_id": "ADM-003",
            "label": "header byte ceiling bounds comment scanning",
            "status": "pass",
            "test_id": "P4-TEST-028"
          },
          {
            "catalog_case_id": "ADM-007",
            "label": "decoder cancellation and deadline return empty typed failures",
            "status": "pass",
            "test_id": "P4-TEST-029"
          },
          {
            "catalog_case_id": "DEC-001",
            "label": "exact small test limits accept valid P6 at boundary",
            "status": "pass",
            "test_id": "P4-TEST-030"
          },
          {
            "catalog_case_id": "DEC-004",
            "label": "concatenated/multipage PNM input rejects",
            "status": "pass",
            "test_id": "P4-TEST-031"
          },
          {
            "catalog_case_id": "ADM-006",
            "label": "descriptor admission remains separate from PNM decoder",
            "status": "pass",
            "test_id": "P4-TEST-032"
          },
          {
            "catalog_case_id": "DEC-001",
            "label": "proposal-only 4096x4096 pixel ceiling PGM decodes",
            "status": "pass",
            "test_id": "P4-TEST-033"
          }
        ],
        "command": [
          "/tmp/image-vision-p4-ijjil7nw/p4-admission-normal"
        ],
        "elapsed_ms": 64.989,
        "exit_code": 0,
        "mode": "normal",
        "status": "pass",
        "stderr": "",